"","INFO","title","surgical_arm","medical_arm","Outcome","fx_type","TESS_p"
"84","CD001802.PUB3 Episodes of sore throat of any severity adults Tonsillectomy or adrenotonsillectomy Watchful waiting with or without analgesics and antibiotics","Tonsillectomy or adenotonsillectomy versus non-surgical treatment for chronic/recurrent acute tonsillitis","Tonsillectomy or adrenotonsillectomy","Watchful waiting with or without analgesics and antibiotics","Episodes of sore throat of any severity adults","MD",0.460871888240896
"85","CD001802.PUB3 Episodes of sore throat of any severity children Tonsillectomy or adrenotonsillectomy Watchful waiting with or without analgesics and antibiotics","Tonsillectomy or adenotonsillectomy versus non-surgical treatment for chronic/recurrent acute tonsillitis","Tonsillectomy or adrenotonsillectomy","Watchful waiting with or without analgesics and antibiotics","Episodes of sore throat of any severity children","MD",0.385531253138457
"86","CD001802.PUB3 Sore throat days (including those immediately post surgery) children Tonsillectomy or adrenotonsillectomy Watchful waiting with or without analgesics and antibiotics","Tonsillectomy or adenotonsillectomy versus non-surgical treatment for chronic/recurrent acute tonsillitis","Tonsillectomy or adrenotonsillectomy","Watchful waiting with or without analgesics and antibiotics","Sore throat days (including those immediately post surgery) children","MD",0.57570712462583
"87","CD001802.PUB3 Sore throat days(including those immediately post_surgery adults Tonsillectomy or adrenotonsillectomy Watchful waiting with or without analgesics and antibiotics","Tonsillectomy or adenotonsillectomy versus non-surgical treatment for chronic/recurrent acute tonsillitis","Tonsillectomy or adrenotonsillectomy","Watchful waiting with or without analgesics and antibiotics","Sore throat days(including those immediately post_surgery adults","MD",0.358533553200571
"88","CD003243.PUB3 GORD_specific quality of life (<1 y) Laparoscopic fundoplication Protein pump inhibitors","Laparoscopic fundoplication surgery versus medical management for gastro-oesophageal reflux disease (GORD) in adults","Laparoscopic fundoplication","Protein pump inhibitors","GORD_specific quality of life (<1 y)","SMD",0.284111467480663
"89","CD003243.PUB3 GORD_specific quality of life (1-5 y) Laparoscopic fundoplication Protein pump inhibitors","Laparoscopic fundoplication surgery versus medical management for gastro-oesophageal reflux disease (GORD) in adults","Laparoscopic fundoplication","Protein pump inhibitors","GORD_specific quality of life (1-5 y)","SMD",0.94510249270291
"90","CD003243.PUB3 Health_related quality of life (<1 y) Laparoscopic fundoplication Protein pump inhibitors","Laparoscopic fundoplication surgery versus medical management for gastro-oesophageal reflux disease (GORD) in adults","Laparoscopic fundoplication","Protein pump inhibitors","Health_related quality of life (<1 y)","SMD",0.213506931335222
"91","CD003243.PUB3 Health_related quality of life (1-5 y) Laparoscopic fundoplication Protein pump inhibitors","Laparoscopic fundoplication surgery versus medical management for gastro-oesophageal reflux disease (GORD) in adults","Laparoscopic fundoplication","Protein pump inhibitors","Health_related quality of life (1-5 y)","SMD",0.627686287250127
"92","CD006983.PUB3 Change in motor score after one year Decompressive surgery Prednisolone","Decompressive surgery for treating nerve damage in leprosy","Decompressive surgery","Prednisolone","Change in motor score after one year","MD",0.640400578860707
"93","CD006983.PUB3 Change in sensory score after one year Decompressive surgery Prednisolone","Decompressive surgery for treating nerve damage in leprosy","Decompressive surgery","Prednisolone","Change in sensory score after one year","MD",0.590871753096832
"94","CD009379.PUB2 Visual acuity at final follow_up Amniotic membrane transplantation and medication Lubrication, Antibiotics and Pressure lowering medication","Amniotic membrane transplantation for acute ocular burns","Amniotic membrane transplantation and medication","Lubrication, Antibiotics and Pressure lowering medication","Visual acuity at final follow_up","MD",0.219286331064863
"95","CD010264.PUB2 Oswestry Disability index 6 w Decompressive surgery with or without fusion Epidural steroid injection","Surgical versus non‐surgical treatment for lumbar spinal stenosis","Decompressive surgery with or without fusion","Epidural steroid injection","Oswestry Disability index 6 w","MD",0.209682563092667
"96","CD010264.PUB2 Pain intensity (VAS) 6 w Decompressive surgery with or without fusion Epidural steroid injection","Surgical versus non‐surgical treatment for lumbar spinal stenosis","Decompressive surgery with or without fusion","Epidural steroid injection","Pain intensity (VAS) 6 w","MD",0.499281266969572
"97","CD010264.PUB2 Zurich claudication questionnaire (symptom evaluation) 6 w Decompressive surgery with or without fusion Epidural steroid injection","Surgical versus non‐surgical treatment for lumbar spinal stenosis","Decompressive surgery with or without fusion","Epidural steroid injection","Zurich claudication questionnaire (symptom evaluation) 6 w","MD",0.493471233515895
"98","CD011160.PUB2 Change in best corrected visual acuity Laser surgery intravitreal anti-VEGF","Anti-vascular endothelial growth factor for choroidal neovascularisation in people with pathological myopia","Laser surgery","intravitreal anti-VEGF","Change in best corrected visual acuity","MD",0.84119837588234
"99","CD011498.PUB2 Medium_term health_related quality of life Oesophagectomy Chemoradiotherapy and/or radiotherapy","Non-surgical versus surgical treatment for oesophageal cancer","Oesophagectomy","Chemoradiotherapy and/or radiotherapy","Medium_term health_related quality of life","MD",0.758272915960675
"100","CD011498.PUB2 Short_term health_related quality of life Oesophagectomy Chemoradiotherapy and/or radiotherapy","Non-surgical versus surgical treatment for oesophageal cancer","Oesophagectomy","Chemoradiotherapy and/or radiotherapy","Short_term health_related quality of life","MD",0.292882597157573
"101","CD013034.PUB2 Knee pain (0-100, 12 mo) Arthroscopic surgery Sclerosing injection","Surgery for patellar tendinopathy (jumper's knee)","Arthroscopic surgery","Sclerosing injection","Knee pain (0-100, 12 mo)","MD",0.422676535331629
"102","CD013034.PUB2 Participant global assessment of success (0-100, 12 mo) Arthroscopic surgery Sclerosing injection","Surgery for patellar tendinopathy (jumper's knee)","Arthroscopic surgery","Sclerosing injection","Participant global assessment of success (0-100, 12 mo)","MD",0.439467028574816
"103","CD013502 Pain (VAS) 12 mo Surgical rotator cuff repair Non-operative treatment including corticosteroid injection and exercise","Surgery for rotator cuff tears","Surgical rotator cuff repair","Non-operative treatment including corticosteroid injection and exercise","Pain (VAS) 12 mo","MD",0.809732597325429
